stock_id,analysis_date,ceo_name,ceo_background,management_team_size,avg_tenure_years,insider_ownership,major_shareholders,corporate_governance,compensation_structure,track_record,strategic_vision,execution_capability,score,notes
2330,2024-03-31,魏哲家,半導體產業資深人士,15,8.5,0.5,台積電員工持股會,優良,績效導向,技術領先、營收成長,技術領先、客戶導向,優秀,92,台積電管理團隊優秀
2317,2024-03-31,劉揚偉,電子產業資深人士,12,6.2,1.2,鴻海集團,良好,績效導向,規模擴張、客戶多元化,規模經濟、客戶服務,良好,72,鴻海管理團隊穩定
2454,2024-03-31,陳冠州,IC 設計產業資深人士,10,7.8,0.8,聯發科員工持股會,優良,績效導向,技術領先、產品線完整,技術領先、產品創新,優秀,88,聯發科管理團隊優秀
2308,2024-03-31,海英俊,電子產業資深人士,11,9.2,0.6,台達電員工持股會,優良,績效導向,技術領先、產品組合優化,技術領先、永續發展,優秀,80,台達電管理團隊穩定
2303,2024-03-31,彭双浪,光電產業資深人士,9,5.5,0.3,友達員工持股會,良好,績效導向,技術轉型、產能調整,技術轉型、產品升級,中等,68,友達管理團隊穩定
2881,2024-03-31,蔡明興,金融產業資深人士,14,10.5,1.5,富邦集團,優良,績效導向,金融服務、風險管理,數位轉型、海外擴張,優秀,78,富邦金管理團隊優秀