stock_id,analysis_date,business_model_type,revenue_streams,value_proposition,competitive_advantage,customer_segments,cost_structure,key_partners,scalability,sustainability,score,notes
2330,2024-03-31,晶圓代工,"先進製程、成熟製程、封裝測試",技術領先、客戶導向,技術領先、客戶黏著度高,"蘋果、高通、輝達等",資本密集、研發投入大,設備商、材料商,高,高,90,台積電商業模式穩健
2317,2024-03-31,電子代工,"消費電子、伺服器、車用電子",規模經濟、客戶服務,規模經濟、客戶結構多元,"蘋果、亞馬遜、特斯拉等",勞動密集、規模經濟,客戶、供應商,高,中,70,鴻海商業模式多元化
2454,2024-03-31,IC設計,"手機晶片、電視晶片、物聯網晶片",技術領先、產品線完整,技術實力強、產品線完整,"三星、小米、OPPO等",研發密集、輕資產,晶圓代工廠、封測廠,高,高,85,聯發科商業模式穩健
2308,2024-03-31,電子零組件,"電源供應器、散熱解決方案、自動化",技術領先、產品組合優化,技術領先、客戶結構優質,"戴爾、惠普、亞馬遜等",研發密集、製造密集,客戶、供應商,中,高,82,台達電商業模式穩健
2303,2024-03-31,光電業,"面板、OLED、車用面板",技術轉型、產品升級,技術轉型順利、產能調整靈活,"三星、LG、索尼等",資本密集、技術密集,設備商、材料商,中,中,65,友達商業模式轉型中
2881,2024-03-31,金融業,"銀行、保險、證券、資產管理",金融服務、風險管理,品牌信譽、客戶基礎穩固,"個人、企業客戶",資本密集、監管成本高,合作夥伴、通路,中,高,75,富邦金商業模式穩健