stock_id,analysis_date,business_risks,financial_risks,market_risks,regulatory_risks,competitive_risks,management_risks,liquidity_risks,currency_risks,geopolitical_risks,black_swan_risks,risk_mitigation,overall_risk_level,risk_rating,score,notes
2330,2024-03-31,技術競爭、產能過剩風險,資本支出壓力,半導體週期波動,各國加強監管,三星、英特爾競爭,管理團隊穩定,流動性充足,匯率波動風險,地緣政治風險,技術突破風險,技術領先、客戶多元化,中等,風險中等,70,台積電風險可控
2317,2024-03-31,客戶集中、毛利率壓力,負債比率較高,電子產業週期波動,各國加強監管,和碩、緯創競爭,管理團隊穩定,流動性充足,匯率波動風險,地緣政治風險,客戶流失風險,客戶多元化、規模經濟,中等,風險中等,65,鴻海風險可控
2454,2024-03-31,技術迭代快、競爭激烈,研發投入大,IC 設計週期波動,各國加強監管,高通、聯發科競爭,管理團隊穩定,流動性充足,匯率波動風險,地緣政治風險,技術突破風險,技術領先、產品創新,中等,風險中等,72,聯發科風險可控
2308,2024-03-31,原物料成本壓力、競爭壓力,負債比率適中,電子零組件週期波動,各國加強監管,台達電競爭,管理團隊穩定,流動性充足,匯率波動風險,地緣政治風險,客戶流失風險,技術領先、客戶多元化,中等,風險中等,68,台達電風險可控
2303,2024-03-31,產業競爭激烈、需求不確定性,負債比率較高,面板產業週期波動,各國加強監管,京東方、三星競爭,管理團隊穩定,流動性充足,匯率波動風險,地緣政治風險,產業衰退風險,技術轉型、產能調整,較高,風險升高,55,友達風險較高
2881,2024-03-31,利率風險、監管風險,資本充足,金融市場波動,金管會加強監管,國泰金、中信金競爭,管理團隊穩定,流動性充足,匯率波動風險,地緣政治風險,金融危機風險,風險管理、多元佈局,中等,風險中等,70,富邦金風險可控